{"type":"config","name":"qb-rankings","metricName":"primary","metricUnit":"pts+penalty","bestDirection":"lower","noiseFloor":1.0,"maxRuns":40,"maxSeconds":null,"targetMetric":null,"startedAt":1786718410}
{"run":1,"commit":"1115afe","metric":80.44,"metrics":{"qb_mae":75.3,"rank_penalty":102.1,"daniels_rank":83,"dart_rank":115,"goff_rank":63},"status":"keep","description":"baseline: current code 100 epochs","timestamp":1786718464,"segment":0}
{"run":2,"commit":"727cca9","metric":80.08,"metrics":{"qb_mae":75.3,"rank_penalty":94.9,"daniels_rank":75,"dart_rank":118,"goff_rank":65},"status":"keep","description":"rush-aware injury correction: w_model 0.10/0.25 for rushers only","timestamp":1786723004,"segment":0}
{"run":3,"commit":"cd7b77d","metric":78.89,"metrics":{"qb_mae":75.3,"rank_penalty":71.1,"daniels_rank":79,"dart_rank":77,"goff_rank":72},"status":"keep","description":"skip exp discount for rush_score>=300 proven rushers","timestamp":1786723123,"segment":0}
{"run":4,"commit":"cd7b77d","metric":78.25,"metrics":{"qb_mae":75.3,"rank_penalty":58.2,"daniels_rank":78,"dart_rank":74,"goff_rank":93},"status":"keep","description":"stronger pocket QB penalty 0.93->0.87 for rush_score<100","timestamp":1786723676,"segment":0}
{"run":5,"commit":"6aefa22","metric":77.95,"metrics":{"qb_mae":75.3,"rank_penalty":52.2,"daniels_rank":78,"dart_rank":74,"goff_rank":94},"status":"keep","description":"QB scarcity weight 0.35->0.42: lifts all QBs in overall rank","timestamp":1786723833,"segment":0}
{"run":6,"commit":"e9aca69","metric":77.25,"metrics":{"qb_mae":75.3,"rank_penalty":38.2,"daniels_rank":64,"dart_rank":74,"goff_rank":94},"status":"keep","description":"lag2-weighted injury anchor for rushing QBs (0.7*lag2+0.3*ep17)","timestamp":1786724095,"segment":0}
{"run":7,"commit":"6ea3c8e","metric":78.48,"metrics":{"qb_mae":76.0,"rank_penalty":49.0,"daniels_rank":55,"dart_rank":77,"goff_rank":76},"status":"discard","description":"higher dropout 0.4/0.3: hurt accuracy QB MAE 76.0, goff back to 76","timestamp":1786728034,"segment":0}
{"run":8,"commit":"6ea3c8e","metric":78.00,"metrics":{"qb_mae":74.3,"rank_penalty":73.4,"daniels_rank":83,"dart_rank":80,"goff_rank":72},"status":"discard","description":"Huber loss delta=60: disrupted rankings despite lower MAE","timestamp":1786728118,"segment":0}
{"run":9,"commit":"6ea3c8e","metric":76.47,"metrics":{"qb_mae":75.1,"rank_penalty":27.2,"daniels_rank":59,"dart_rank":79,"goff_rank":95},"status":"keep","description":"150 epochs: better convergence, rank_penalty 38.2->27.2","timestamp":1786728332,"segment":0}
{"run":10,"commit":"6eb2ef4","metric":76.37,"metrics":{"qb_mae":75.1,"rank_penalty":25.9,"daniels_rank":53,"dart_rank":60,"goff_rank":82},"status":"discard","description":"200 epochs: marginal primary improvement, Goff regressed 95->82","timestamp":1786728696,"segment":0}
{"run":11,"commit":"a90a99c","metric":76.47,"metrics":{"qb_mae":75.1,"rank_penalty":27.2,"daniels_rank":59,"dart_rank":79,"goff_rank":95},"status":"discard","description":"rush_score<50: 0.83 penalty — no effect, Goff is in 50-100 range","timestamp":1786728969,"segment":0}
{"run":12,"commit":"a90a99c","metric":75.71,"metrics":{"qb_mae":73.9,"rank_penalty":35.5,"daniels_rank":64,"dart_rank":55,"goff_rank":82,"mahomes_rank":73},"status":"discard","description":"wider network 128->64->32->1: QB MAE improved but rank_penalty worse (35.5 vs 27.2), Maye #35 (target 75) — within noise floor","timestamp":1786730567,"segment":0}
{"run":13,"commit":"a90a99c","metric":76.23,"metrics":{"qb_mae":74.7,"rank_penalty":31.4,"daniels_rank":59,"dart_rank":64,"goff_rank":95,"mahomes_rank":78},"status":"discard","description":"add lag2_carries+lag3_carries to QB features: MAE improved (74.7) but rank_penalty worse (31.4), Maye exploded to #26, Mahomes worse (#78), within noise floor","timestamp":1786730967,"segment":0}
{"run":14,"commit":"a90a99c","metric":85.88,"metrics":{"qb_mae":75.8,"rank_penalty":202.5,"daniels_rank":228,"dart_rank":50,"goff_rank":82,"mahomes_rank":53},"status":"discard","description":"add lag2_rush_yards+ewma_rush_yards: catastrophic — model learned inverse (high lag2_rush → worse next season), Daniels #228, rank_penalty=202","timestamp":1786731275,"segment":0}
{"run":15,"commit":"a90a99c","metric":81.96,"metrics":{"qb_mae":74.4,"rank_penalty":151.7,"daniels_rank":195,"dart_rank":52,"goff_rank":121,"mahomes_rank":54},"status":"discard","description":"pocket QB penalty 0.82 + QB scarcity 0.52 bundle: VOR amplifies negative VOR for below-replacement QBs (Daniels #195, Burrow #211) — higher scarcity backfires when base projections are low","timestamp":1786731507,"segment":0}
{"run":16,"commit":"15fa786","metric":78.28,"metrics":{"qb_mae":76.2,"rank_penalty":41.6,"daniels_rank":54,"dart_rank":84,"goff_rank":91,"mahomes_rank":94},"status":"keep","description":"fix determinism (set_num_threads=1) + add ewma_fpts_proj17 to QB features: enables injury correction for Daniels (#172->54) and Burrow (#168->48); re-baselines from stochastic 76.47 to deterministic 81.15->78.28","timestamp":1786732743,"segment":0}
{"run":17,"commit":"15fa786","metric":77.42,"metrics":{"qb_mae":76.2,"rank_penalty":24.4,"daniels_rank":49,"dart_rank":84,"goff_rank":118,"mahomes_rank":97},"status":"discard","description":"QB scarcity 0.52 + pocket penalty 0.82: mean improvement 0.65 across seeds 42/99 — below cross-seed noise floor ~1.3; rankings improved (Daniels target, Goff target) but Allen/Mahomes still too low","timestamp":1786733007,"segment":0}
{"run":18,"commit":"15fa786","metric":80.25,"metrics":{"qb_mae":77.0,"rank_penalty":65.9,"daniels_rank":56,"dart_rank":117,"goff_rank":96,"mahomes_rank":100},"status":"discard","description":"lower LR 5e-4: underfits at 150 epochs, QB MAE 76.2->77.0, Dart #117, rank_penalty 65.9","timestamp":1786733387,"segment":0}
{"run":19,"commit":"15fa786","metric":77.44,"metrics":{"qb_mae":76.2,"rank_penalty":24.9,"daniels_rank":49,"dart_rank":84,"goff_rank":118,"mahomes_rank":97},"status":"discard","description":"Exp 19: scarcity 0.52 + pocket 0.82 + injury threshold <14: primary 77.44 still below noise floor (delta 0.84 < 1.0); Daniels #49 Goff #118 Darnold #122 Allen #32 Mahomes #97","timestamp":1786733696,"segment":0}
{"run":20,"commit":"cfe238e","metric":77.06,"metrics":{"qb_mae":76.2,"rank_penalty":17.2,"daniels_rank":51,"dart_rank":86,"goff_rank":121,"mahomes_rank":59,"seed99_primary":75.20},"status":"keep","description":"Exp 20: scarcity 0.52 + pocket penalty 0.82 + injury threshold <15 (catches Mahomes 14g, Lamar 13g); seed42=77.06 seed99=75.20 mean_improvement=2.15 >> noise floor; Mahomes #59 Daniels #51 Goff #121 Darnold #123 Allen #34","timestamp":1786733842,"segment":0}
{"run":21,"commit":"cfe238e","metric":76.90,"metrics":{"qb_mae":76.0,"rank_penalty":18.6,"daniels_rank":55,"dart_rank":84,"goff_rank":159,"mahomes_rank":58},"status":"discard","description":"add prev_fpts_per_game to QB features: tiny MAE gain (76.2->76.0) but Goff drops to #159 (over-penalized via 0.82x), rank_penalty 17.2->18.6, net -0.16 below noise floor","timestamp":1786736160,"segment":0}
{"run":22,"commit":"cfe238e","metric":76.21,"metrics":{"qb_mae":75.3,"rank_penalty":18.6,"daniels_rank":58,"dart_rank":77,"goff_rank":161,"mahomes_rank":62},"status":"discard","description":"add rush_yards_per_game to QB features: QB MAE 76.2->75.3 (great!), but Daniels drops #51->58 (anchor not compensating), rank_penalty 17.2->18.6; net 0.85 below noise floor; need to bundle with stronger Daniels correction","timestamp":1786736291,"segment":0}
{"run":23,"commit":"cfe238e","metric":75.81,"metrics":{"qb_mae":75.3,"rank_penalty":10.6,"daniels_rank":50,"dart_rank":77,"goff_rank":161,"mahomes_rank":62,"seed99_primary":76.66},"status":"discard","description":"bundle rush_yards_per_game + stronger Daniels anchor (0.85/0.15): seed42=75.81 (1.25 improvement) but seed99=76.66 (1.46 WORSE than baseline 75.20); cross-seed mean 76.24 > baseline 76.13; cross-seed variance washes gain","timestamp":1786736479,"segment":0}
{"run":24,"commit":"cfe238e","metric":75.50,"metrics":{"qb_mae":74.6,"rank_penalty":18.9,"daniels_rank":61,"dart_rank":79,"goff_rank":162,"mahomes_rank":68,"seed99_primary":76.77},"status":"discard","description":"remove lag3_fantasy_ppr: QB MAE 76.2->74.6 (great) but seed99=76.77 (vs baseline 75.20); cross-seed means equal (76.135 vs 76.130); rank variance too high — lag3 stabilizes training","timestamp":1786736898,"segment":0}
{"run":25,"commit":"cfe238e","metric":77.34,"metrics":{"qb_mae":76.2,"rank_penalty":22.9,"daniels_rank":56,"dart_rank":86,"mahomes_rank":64,"seed99_primary":75.19},"status":"discard","description":"rush tier 1.18->1.22x for rush_score>=600: seed42=77.34 (worse!), seed99=75.19; mean 76.265 > baseline 76.13; boosts Lamar/Maye equally so no relative Allen gain; rank_penalty 22.9 (worse)","timestamp":1786737010,"segment":0}
{"run":26,"commit":"cfe238e","metric":77.51,"metrics":{"qb_mae":76.2,"rank_penalty":26.2,"daniels_rank":56,"dart_rank":87,"mahomes_rank":61,"seed99_primary":75.30},"status":"discard","description":"MC samples 50->100: seed42=77.51 (WORSE), seed99=75.30; mean 76.41 worse than baseline 76.13; more samples converge to true lower mean for Allen (#40 seed42), worsening rankings","timestamp":1786737268,"segment":0}
{"run":27,"commit":"cfe238e","metric":76.88,"metrics":{"qb_mae":76.2,"rank_penalty":13.7,"daniels_rank":49,"dart_rank":86,"mahomes_rank":57,"seed99_primary":74.94},"status":"discard","description":"VOR scarcity 0.52->0.58: seed42=76.88 (+0.18), seed99=74.94 (+0.26); consistent direction but mean improvement 0.22 < noise floor 0.93; rank_penalty 17.2->13.7 (seed42), ~24->18.9 (seed99)","timestamp":1786737402,"segment":0}
{"run":28,"commit":"cfe238e","metric":75.70,"metrics":{"qb_mae":75.3,"rank_penalty":8.5,"daniels_rank":48,"dart_rank":77,"mahomes_rank":60,"seed99_primary":76.36},"status":"discard","description":"bundle: scarcity 0.58 + rush_yards_per_game + Daniels anchor 0.85; seed42=75.70 (+1.36!) seed99=76.36 (-1.16); cross-seed mean 76.03 (only 0.10 improvement); rush_yds_per_game consistently helps seed42, hurts seed99","timestamp":1786737550,"segment":0}
{"run":29,"commit":"cfe238e","metric":76.95,"metrics":{"qb_mae":76.2,"rank_penalty":15.2,"daniels_rank":50,"mahomes_rank":59,"seed99_primary":75.12},"status":"discard","description":"weight_decay 1e-4->5e-4: seed42=76.95 (+0.11), seed99=75.12 (+0.08); consistent direction but mean improvement 0.095 below noise floor; both seeds improved slightly","timestamp":1786737742,"segment":0}
{"run":30,"commit":"cfe238e","metric":76.27,"metrics":{"qb_mae":75.4,"rank_penalty":18.1,"daniels_rank":57,"mahomes_rank":62,"seed99_primary":77.12},"status":"discard","description":"weight_decay 5e-4 + rush_yards_per_game: seed42=76.27 (+0.79 MAE) but seed99=77.12 (-1.92, Daniels #64, MAE 75.6 WORSE!); rush_yards_per_game affects MAE oppositely per seed — not reliably learnable in 150 epochs","timestamp":1786737742,"segment":0}
{"run":31,"commit":"9c1d159","metric":76.80,"metrics":{"qb_mae":76.2,"rank_penalty":12.2,"daniels_rank":49,"mahomes_rank":57,"seed99_primary":74.90},"status":"keep","description":"scarcity 0.52->0.58 + weight_decay 1e-4->5e-4: seed42=76.80 (+0.26), seed99=74.90 (+0.30); cross-seed mean 75.85 beats baseline 76.13; consistent improvement both seeds; Daniels #49 Allen #26 Mahomes #57 rank_penalty 12.2","timestamp":1786737877,"segment":0}
{"run":32,"commit":"80d41e4","metric":76.75,"metrics":{"qb_mae":76.2,"rank_penalty":11.2,"daniels_rank":48,"mahomes_rank":53,"seed99_primary":74.79},"status":"keep","description":"scarcity 0.58->0.65: seed42=76.75 (+0.05), seed99=74.79 (+0.11); cross-seed mean 75.77 vs 75.85 (+0.08); Goff drops to #125 (rushing QBs gain VOR more proportionally); Allen #24 Mahomes #53 rank_penalty 11.2","timestamp":1786737987,"segment":0}
{"run":33,"commit":"264140d","metric":76.65,"metrics":{"qb_mae":76.2,"rank_penalty":9.2,"daniels_rank":44,"mahomes_rank":51,"seed99_primary":74.37},"status":"keep","description":"scarcity 0.65->0.75: seed42=76.65 (+0.10), seed99=74.37 (+0.42); cross-seed mean 75.51 vs 75.77 (+0.26); Allen #20 (s42) #15 (s99), Mahomes below-target no penalty; rank_penalty 9.2 (s42) 8.6 (s99)","timestamp":1786738080,"segment":0}
{"run":34,"commit":"b05718b","metric":76.63,"metrics":{"qb_mae":76.2,"rank_penalty":8.9,"daniels_rank":42,"mahomes_rank":50,"seed99_primary":74.25},"status":"keep","description":"scarcity 0.75->0.85: seed42=76.63 (+0.02), seed99=74.25 (+0.12); mean 75.44 (+0.07); Allen #18 s42 #14 s99; rank_penalty 8.9/6.1; diminishing returns","timestamp":1786738167,"segment":0}
{"run":35,"commit":"b05718b","metric":76.63,"metrics":{"qb_mae":76.2,"rank_penalty":8.9,"daniels_rank":42,"seed99_primary":74.25},"status":"discard","description":"scarcity 0.85->0.95: IDENTICAL to Exp 34 — metric plateaued; scarcity 0.85 already saturates VOR ordering; no change in rank or primary","timestamp":1786738240,"segment":0}
{"run":36,"commit":"b05718b","metric":76.63,"metrics":{"qb_mae":76.2,"rank_penalty":8.9,"daniels_rank":42,"seed99_primary":74.25},"status":"discard","description":"Daniels anchor w_lag2=0.85 for games<8: cross-seed improvement only 0.05 (75.39 vs 75.44) — below noise floor; seed42 unchanged at 76.63, seed99 +0.10 (74.15)","timestamp":1786738599,"segment":0}
{"run":37,"commit":"b05718b","metric":76.64,"metrics":{"qb_mae":76.2,"rank_penalty":9.1,"daniels_rank":48,"seed99_primary":74.22},"status":"discard","description":"ultra-elite rush tier >=900: 1.23x — cross-seed mean 75.43 vs 75.44 (-0.01); rank_penalty 9.1/5.5 s42/s99; injury correction cancels Daniels boost; Allen rank barely improves","timestamp":1786738763,"segment":0}
{"run":38,"commit":"b05718b","metric":77.38,"metrics":{"qb_mae":76.2,"rank_penalty":23.8,"daniels_rank":48,"dart_rank":109,"seed99_primary":74.25},"status":"discard","description":"veteran rush bonus 1.22x for exp>=5 rush>=600: rank_penalty 8.9->23.8; Allen moved up but Dart displaced from #87->109 in cross-position ranking; net effect catastrophic; displacement >> direct gain","timestamp":1786741335,"segment":0}
{"run":39,"commit":"b05718b","metric":76.63,"metrics":{"qb_mae":76.2,"rank_penalty":8.9,"daniels_rank":41,"dart_rank":87,"seed99_primary":74.25},"status":"discard","description":"pocket QB penalty 0.82->0.77: cross-seed mean identical 75.44; rank_penalty unchanged 8.9/6.1; affected pocket QBs already below Allen/Dart threshold in rankings — no room to help","timestamp":1786742030,"segment":0}
{"run":40,"commit":"b05718b","metric":79.31,"metrics":{"qb_mae":76.87,"rank_penalty":48.9,"daniels_rank":45,"dart_rank":147,"seed99_primary":74.25},"status":"discard","description":"cosine annealing LR scheduler: catastrophic — qb_mae 76.19->76.87, rank_penalty 8.9->48.9, Dart #147; LR decay to near-zero changes gradient landscape, model finds worse local minimum, disrupts calibration","timestamp":1786748085,"segment":0}
